{
  "schema_version": "agentic.eval.task/v1alpha1",
  "id": "client-go-closed-event-channel",
  "pilot": true,
  "repository": {
    "name": "client-go",
    "url": "https://github.com/kubernetes/client-go",
    "base": "2517e8773a2335d1bd0295319fe749f38a3bfcbb",
    "target": "187c42c88498188fc72b161f2c04d77ce3716866"
  },
  "prompt": "Ensure an event-watcher goroutine exits when its result channel closes during direct broadcaster shutdown instead of spinning until context cancellation.",
  "scope": {
    "workspace": ".",
    "packages": ["./tools/record"],
    "allowed_paths": ["tools/record/event.go", "tools/record/event_test.go"]
  },
  "oracle": { "overlay_paths": ["tools/record/event_test.go"] },
  "acceptance": [
    { "argv": ["go", "test", "./tools/record", "-run", "^TestStartEventWatcherExitsOnDirectShutdown$", "-count=1"], "timeout_seconds": 240 }
  ],
  "invariants": [
    "A closed ResultChan terminates the watcher goroutine immediately.",
    "Queued events are not dropped before broadcaster shutdown closes watchers.",
    "No watcher goroutine leaks after direct shutdown."
  ],
  "exercises": ["concurrency", "channel-lifecycle", "symbol-context", "verification"]
}
